userID,caption,trial_number,image_name,group,tag,evaluator
20240910175555,"A traveler treks upward a steep snowy trail in a quiet forest, taking in the serene winter landscape. The traveler is using tools to be able to climb up the snowy mountain as two of the other tools is stuck into the ground.",11,Image_15.png,default,D5,8
20240910221148,"A group of individuals stands by an indoor water feature, engaging with the exhibit. There are orange fishes in the pond in front of them. There is a small girl who is in the midst of jumping in the water. Her sister is grabbing her to stop her from jumping in. There is a bored girl in a white shirt stating off into the distance. ",6,Image_2.png,effort,E4,8
20240910180338,A lone man fishes beside a tranquil lake at dawn under the shelter of a large tree. The lake is covered in morning mist and the sun shines through pine trees on the other side.,10,Image_3.png,default,D6,8
20240910154224,Many various city pedestrians fill the crosswalk and sidewalk where a colorful street vendor cart is parked.,1,Image_5.png,default,D2,8
20240910154427,Two customers a man wearing a light green button downed shirt and a woman wearing a white short sleeve shirt interact with a vendor at a dimly lit outdoor market. The vendor has an assortment of different foods on a table and in the background a taxi cab can be seen.,12,Image_6.png,default,D3,8
20240910161920,"A man in a red jacket, black cap and shorts sits on a bench surrounded by greenery, preparing a meal outdoors",2,Image_7.png,default,D4,8
20240910172445,"A red off-road vehicle is perched on an uneven dirt path, in a desert like area with brown weed like growth on the hillside. The vehicle appears to be stuck, having crossed terrain that caused it to tilt. There is a young girl, alone in the background. .",11,Image_9.png,effort,E2,8
20240910221148,"A young individual stands in a grassy area, with her horse, holding a rope, with a small fire in the foreground and open land in the background. The girl is waring a black sweather, shorts and boots. There is an older man standing in the background with his horse. ",8,Image_1.png,effort,E4,9
20240910141502,An older gentleman sits on a park bench while talking on the phone. His large black dog sits on the bench beside him. There are also people enjoying a leisurely walk on a paved pathway as they pass a woman sitting on another bench. There is a large pavilion in the background surrounded by trees and lush grass. The sky is cloudy.,9,Image_10.png,default,D1,9
20240910154224,An older couple sit on a bench overlooking a calm sea with a boat floating away as the sun sets in the distance. You can also see a skyline in the background,7,Image_11.png,default,D2,9
20240910172445,"A young boy, with a look of determination on his face, is enjoying a sunny, cloudless day outside on a scooter on a paved surface. He wears a safety helmet, t-shirt, shorts, and tennis shoes. He is the only person seen in the area. There are houses and vehicles in the background. ",10,Image_12.png,effort,E2,9
20240910224454,"Two athletes, both female, are in a competitive chase for the ball during a soccer match. The one blue attired girl behind the white and black clothed girl nearest to the ball is about to fall onto her in an attempt for the ball. ",6,Image_13.png,effort,E6,9
20240910180338,A mountain climber in black hiking gear and a backpack kit uses ice picks to climb up a snowy incline. The landscape is a snow-covered cliff and there are hiking sticks stuck in the snow in front of the climber.,7,Image_15.png,default,D6,9
20240910221648,A group of individuals stands by an indoor pool of water with koi fish,12,Image_2.png,effort,E5,9
20240910221147,"A short-haired male wearing a hat and dark long sleeved shirt and pants stands beside a tranquil foggy lake at dawn, under the shelter of a large tree.",2,Image_3.png,effort,E3,9
20240910154427,"In the backdrop of a busy city with crowds of people, the bottom half of large buildings, and cars an artistic cart with two wheels attached to the back half of a yellow bike is shown. The cart contains vibrant abstract paintings on the side of it with people walking by it.",4,Image_5.png,default,D3,9
20240910161920,Customers interact with a street food vendor at a dimly lit outdoor market. A yellow vehicle is behind them.,6,Image_6.png,default,D4,9
20240910165019,A man sits on a wooden bench among a profusion of green plants. The man wears a cap and a jacket with shorts. He is stirring a pot of food set on the bench. There is an inert flamethrower beside him.,12,Image_7.png,effort,E1,9
20240910175555," A red off-road vehicle seemingly stuck on an uneven terrain with the back right wheel stuck in between the ridges of the terrain. The male driver inside, wearing sun glasses, is trying to move the vehicle past being stuck. A little girl wearing a light green shirt with denim blue shorts spectate on the side while standing on a dry grass pathway looking concerned.",1,Image_9.png,default,D5,9
20240910221648,"A young individual stands next to a horse in a grassy area, holding a lead to a horse's reins, with a small fire in the foreground and wooded area and older individual and another horse in the background",4,Image_1.png,effort,E5,10
20240910154224,People enjoy a leisurely walk on a paved pathway in a park with benches filled with more people. Clean green grass is alongside everyone on the cloudy day,3,Image_10.png,default,D2,10
20240910154427,The backs of two people sitting on a bench overlooking a calm sea as the sun sets in the distance. On the sea a boat can be seen and in the distance the landscape of a city along the seas edge with a fading skyline.,11,Image_11.png,default,D3,10
20240910175555,"A young boy is wearing an orange helmet, grey shorts, nike high top shoes, and a yellow shirt with blue sleeves. The boy is riding a scooter and in a mid-jump position with a stressed face. In the background, several houses can be seen with cars parked in their respective garages.",5,Image_12.png,default,D5,10
20240910141502,"Two female athletes on opposing teams, one in blue and one is white, are chasing after a soccer ball during a soccer match on a grassy field. The athlete in blue has stern look on her face and is poised to shove the athlete in white, who is closer to the ball, from behind. The athlete in white appears as if she is yelling and is in the process of tripping over the ball. Two other athletes, each from opposing teams, are in the distance as they watch the battle play out.",1,Image_13.png,default,D1,10
20240910221147,"A hiker climbs upwards on a snowy trail in a quiet forest, using ice picks. ",3,Image_15.png,effort,E3,10
20240910224454,"A mixed group of varying aged individuals stands by an indoor fish pond which looks like a very shallow public pool, engaging with the small orange and black spotted fish. There is a plant with large leaves in the foreground. The children on the edge of the pool are laughing with excitement. People in the background are glancing at the family enjoying the fish while they continue walking.",4,Image_2.png,effort,E6,10
20240910221148,"A lone figure stands beside a tranquil lake at dawn, under the shelter of a large tree. The sky is cloudy and there is a thick fog over the lake. There is a silihoute of trees in the background. ",5,Image_3.png,effort,E4,10
20240910161920,City pedestrians walk by a colorful puppet theatre cart on a busy day. There are many pedestrians walking along the busy street in the back. There are also five traffic lights in sight navigating the busy streets.,3,Image_5.png,default,D4,10
20240910165019,A night scene of a street vendor standing at a table laden with food. Two people stand on the other side of the table looking at the food. Behind them there is a taxi.,10,Image_6.png,effort,E1,10
20240910172445,"A man in a red jacket, wearing shorts, a cap, and tennis shoes, with hiking gear behind him and a water bottle beside him, sits on a wooden park bench surrounded by greenery, outdoors. He is preparing and stirring food in a silver pot. There is a plant with a small purple flower beside the bench.",8,Image_7.png,effort,E2,10
20240910180338,A red off-road vehicle is perched partially in a ditch on an uneven dirt path with a young girl watching nearby. It's a bright sunny day in dry scrubland and the vehicle's tires are bent to adjust to the uneven ground.,6,Image_9.png,default,D6,10
20240910224454,"A young blonde woman with a black sweatshirt stands next to a brown horse in a grassy field, holding a rope, stares into a  small fire in the foreground. A tall older male wearing a blue shirt and denim jeans stands next to a larger, dark brown horse in the background, looking towards the woman. Both seem to be contemplating something.",1,Image_1.png,effort,E6,11
20240910154427,"In the middle of a park, people enjoy a leisurely walk on a paved pathway surrounded by lush green grass and trees. Natural wood looking benches are spread along the path, with a man and a grey dog sitting on one. In the background a large gazebo can bee seen with many people gathered underneath. ",7,Image_10.png,default,D3,11
20240910161920,A man and woman sit on a bench overlooking a calm sea and the city that sists across the sea as the sun sets in the distance. There is a boat moving on the calm sea.,10,Image_11.png,default,D4,11
20240910180338,"A young boy in a yellow shirt, Nike sneakers and an orange helmet rides a Razor scooter onto a sidewalk. The background is a suburban neighborhood with white and gray houses and a cloudless blue sky.",9,Image_12.png,default,D6,11
20240910154224,"Two high school/college female athletes in a competitive chase for the ball during a soccer match. Each on opposing teams, the suspense is high",5,Image_13.png,default,D2,11
20240910221148,"A traveler treks across a gentle snowy trail in a quiet forest, taking in the serene winter landscape. There are footsteps in the snow in front of him. He is surprisingly not wearing a jacket and is wearing a helmet. He is holding hooks with his hands and digging them into the snow to keep balance. There is a pair of walking sticks buried in the snow in front of him.",11,Image_15.png,effort,E4,11
20240910141502,"A group of individuals, both young and old, are standing by an indoor water exhibit. Young children are intently focused on the fish in the water of the exhibit. Some children are sitting and leaning on the brick barrier of the exhibit. The older adults are focusing on the smaller children to make sure they do not hurt themselves on the ledge. Other individuals are walking past the exhibit in the background. ",10,Image_2.png,default,D1,11
20240910221648,"A lone figure stands fishing beside a tranquil lake with fog at dawn, under the shelter of a large tree, and trees and hills in the background",2,Image_3.png,effort,E5,11
20240910165019,"Pedestrians walk on a busy city street. In the foreground, a colorful cart is parked on the sidewalk with the words ""Puppet Theatre"" painted on the side of the cart. The cart is attached to a trailer that is pulled by a bicycle. A man and woman walk past the cart. In the background, there are pedestrians and traffic visible on the street. Tall buildings rise in the background.",7,Image_5.png,effort,E1,11
20240910172445,Customers interact with a street vendor selling food at a dimly lit outdoor market at nighttime with the vehicular and pedestrian traffic in the background.,6,Image_6.png,effort,E2,11
20240910175555,"A man in a red jacket, white shorts, and black cap sits on a gray bench surrounded by green plants, preparing a meal outdoors. The meal is being cooked in an electric stainless steel pan with a stainless steel tumbler in the back of it. ",8,Image_7.png,default,D5,11
20240910221147,A man in a green shirt observes the roof of a red off-road vehicle that is perched on an uneven dirt path with a woman in shorts in the distance.,5,Image_9.png,effort,E3,11
20240910141502,A young woman dressed in a black sweatshirt and jeans stands in a grassy area next to a brown horse. The young woman is holding a rope and looks on with concern at a small fire in the foreground. In the background stands an older man dressed in a long sleeve light blue shirt and blue jeans. The man is looking on at the young girl and the fire while standing next to another brown horse. There are trees and an open field behind the man.,11,Image_1.png,default,D1,12
20240910161920,People enjoy a leisurely walk on a paved pathway in a park with benches and lush grass on a cloudy day. Some of the people sit on the benches to watch the passers by and take in the beautiful scenery. The trees hower above their heads,7,Image_10.png,default,D4,12
20240910165019,"Two people sit on a bench overlooking a body of water. The water is calm. A boat travels past along the water. The sun is setting. On the far shore of the water, the silhouette of a city is visible against the sunset.",2,Image_11.png,effort,E1,12
20240910221147,A male child wearing a blue and a yellow shirt is riding his scooter on the sidewalk of a mobile home neighborhood on a sunny day.,1,Image_12.png,effort,E3,12
20240910154427,"Two female athletes one behind the other are competing for a soccer ball. The foremost player with the ball is wearing a white jersey with black shorts, the other player is wearing matching blue shirt and shorts. They are playing on a green grass field and in a semi blurred background two additional players are seen one from each team.",3,Image_13.png,default,D3,12
20240910221648,"A man in climbing gear, climbs a steep snowy cliff side with rocks and snow covering the background",11,Image_15.png,effort,E5,12
20240910154224,A group of young children stand by an indoor water feature. Engaging with the exhibit that contains a couple fish and plants. It looks as though parents are even trying to get one of the kids away from the exhibit.,4,Image_2.png,default,D2,12
20240910224454,"A lone figure stands beside a tranquil lake at dawn, under the shelter of a large lone tree with the sun shining in from the north. The man is standing upright while he fishes. The misty lake is reflecting the sun and sparse trees from the north side. Tall grass and small foliage is in the foreground behind the man.",7,Image_3.png,effort,E6,12
20240910172445,City pedestrians bustle by a colorful street vendor cart in a big city with tall rise buildings in the background on a busy day.,5,Image_5.png,effort,E2,12
20240910175555,"Customers interact with a vendor selling a variety of street food at a dimly lit outdoor market. The vendor has a cart with a bunch of condiments on it and various food. In the background, a yellow taxi can be seen passing by.",12,Image_6.png,default,D5,12
20240910180338,"A man in a red jacket, cargo shorts, and a black hat sits on a wooden bench surrounded by lush green shrubs. He is stirring food in a portable cooker that's sitting on the bench next to him.",3,Image_7.png,default,D6,12
20240910221148,A red off-road vehicle is perched on an uneven dirt path with a spectator in the distance. The vehicle hanging from the side of a mountain and is uneasily sitting on a dirt patch. The windows of the Jeep are open and there is a driver inside. ,10,Image_9.png,effort,E4,12
