userID,caption,trial_number,image_name,group,tag,evaluator
20240815025304,"A young girl wearing a black sweatshirt standing beside her brown horse in a grassy area, holding a rope, with a small fire in the foreground and open land in the background",3,Image_1.png,default,D1,10
2024,People enjoy a leisurely walk on a paved pathway in a park with benches and lush grass on a cloudy day,1,Image_10.png,control,O,10
20240815025546,A couple sits on a bench overlooking the beautiful sunset and calm sea; a boat is visualized at sea.,4,Image_11.png,default,D3,10
20240815225435,"A young teen boy is enjoying a sunny day outside on a scooter. he wears athletic shoes and a yellow and blue shirt. He wears an orange helmet while riding unto the sidewalk. The photo is taken in a Dutch angle, suburban homes in the background",8,Image_12.png,effort,E4,10
20240816125625,Two athletes in a competitive chase for the ball during a soccer match,11,Image_13.png,effort,E5,10
2024,"A traveler treks across a gentle snowy trail in a quiet forest, taking in the serene winter landscape",1,Image_15.png,control,O,10
20240815030001,"A group of people stands by an indoor water feature, engaging with the exhibit",10,Image_2.png,default,D5,10
20240815025733,"A man standing at the lake side at dawn under a long tree holding a long stick. wearing black dress,there is a big tree behind where the man is standing,there are more trees behind the lake.the water looks clean.",3,Image_3.png,default,D4,10
20240815224654,"Many pedestrians walk a New York City street, walking past a colorful puppet theatre street cart. ",7,Image_5.png,effort,E3,10
20240815031204,"Two customers, man and woman interact with a vendor at a dimly lit outdoor market. A taxi cab closely in the background and a tree stands to the left of the street vendor.",10,Image_6.png,effort,E1,10
20240815224510,"A man in a red jacket sits on a bench surrounded by greenery, preparing a meal outdoors. He has a black cap on that obscures the top portion of his face, and has rectangle classes perched upon his reddened nose. He is gazing down at the meal he is preparing with a soft upturn of his lips. The greenery around him has two visible purple flowers, and in the background towards the right are several square shaped objects. What they are is unclear.",12,Image_7.png,effort,E2,10
20240815025417,A red off-road Jeep-type vehicle is perched on an uneven dirt path in the desert. The vehicle looks stuck and is possibly damaged. A young girl looks on from a distance. She is wearing blue shorts and a light green top. ,3,Image_9.png,default,D2,10
20240815025417,"A teenage girl stands in a grassy area, holding a rope. She is wearing a black long-sleeved sweatshirt and black riding boots. She is next to a light brown horse with a white line up its face. They are standing in green grass near a small campfire in the foreground. In the background is a man dressed in blue and another brown horse. A short wood fence encloses the area and beyond the field is a stand of evergreen trees.",4,Image_1.png,default,D2,11
20240815031204,"People enjoy a leisurely walk on a paved pathway in a park, A gazebo in the background and a dog sitting on the bench with his owner, The grounds covered in  lush grass and green trees on a cloudy day",11,Image_10.png,effort,E1,11
20240815025733,Two people sit on a bench overlooking a calm sea as the sun sets in the distance,9,Image_11.png,default,D4,11
20240816125625,A young person is enjoying a sunny day outside on a scooter. He has a helmet on.,6,Image_12.png,effort,E5,11
20240815025304,Two athletic women are in a competitive chase for the ball during a soccer match,4,Image_13.png,default,D1,11
20240815031204,"A traveler dressed in black carrying a black backpack climbs up a steep snowy trail on a rocky terrain, two walking sticks await him in the foreground ",7,Image_15.png,effort,E1,11
2024,"A group of individuals stands by an indoor water feature, engaging with the exhibit",1,Image_2.png,control,O,11
20240815030001,"A lone figure stands beside a tranquil lake at dawn, under the shelter of a large tree ",4,Image_3.png,default,D5,11
20240815225435,"City pedestrians walk by a colorful street vendor cart on a busy day. On the left hand side a middle aged man with a brown jacket holding hands with a blonde woman wearing a turtle neck sweater and a coat. On the right, a bicycle is linked to the vendor cart. ",4,Image_5.png,effort,E4,11
20240815224510,"Three customers -- one man, one woman, and a person that is obscured by a tree on the left side of the photo -- interact with a vendor at a dimly lit outdoor market. The vendor stand looks cluttered, and there is an assortment of food, bottled drinks, and baskets on the table. The man is wearing a white, long sleeved button down, and has his lips pursed as he reaches for something on the vendors stand. The woman, who is wearing a white, short sleeved shirt, is looking at what he is doing with upturned lips. Behind the customers is a yellow taxi driving by.",4,Image_6.png,effort,E2,11
20240815224654,"A man in a red jacket sits on a bench surrounded by greenery, preparing a meal outdoors",3,Image_7.png,effort,E3,11
20240815025546,A red jeep is wrecked on an uneven bumpy path with a pedestrian nearby.,6,Image_9.png,default,D3,11
