userID,caption,trial_number,image_name,group,tag,evaluator
20241126032439,"A man in a red jacket sits on a bench surrounded by greenery, preparing a meal outdoors on the bench he is sitting on. ",5,Image_7.png,effort,E12,10
20241122014416,A red off-road vehicle is perched on an uneven dirt path with a spectator in the distance.,3,Image_9.png,effort,E2,10
20241122030706,"A young girl stands in a grassy area with a tan horse being led with a bridal, with a small fire in the foreground and open land with an additional horse being led by a man in the background",4,Image_1.png,effort,E5,11
2024,People enjoy a leisurely walk on a paved pathway in a park with benches and lush grass on a cloudy day,1,Image_10.png,control,O,11
20241122213136,Two people sit on a bench overlooking a calm sea as the sun sets in the distance. There is a small boat on the sea and buildings on the other side of the sea.,9,Image_11.png,effort,E7,11
20241122214316,"A young boy is enjoying a sunny day outside on a scooter. He is wearing a yellow and blue shirt, with gray shorts, and white, black, and red Nike sneakers. He is also wearing an orange helmet with the number ""20"" on it. He rides over the curb on a silver scooter with green wheels and handles. Behind him are ranch-style buildings with various trucks parked outside.",12,Image_12.png,effort,E8,11
20241122014416,Two athletes are in a competitive chase for the ball during a soccer match.,5,Image_13.png,effort,E2,11
20241121233403,"A  snow climber going over a cold,snow covered steep and rocky hills",9,Image_15.png,effort,E1,11
20241126032439,"A crowd of people looking over a water exhibit with a handful of fish swimming in it.  The people include kids who seem very excited with interacting with the exhibit, but one girl seems disintrested. ",2,Image_2.png,effort,E12,11
20241122020904,"A lone man stands beside a tranquil lake at dawn, under the shelter of a large tree. The man has cast a fishing rod and it waiting for a bite. There is fog dancing across the water, and tall grass in the foreground of the photo.",2,Image_3.png,effort,E4,11
20241122210318,Chicago City pedestrians walk by a colorful street vendor puppet show cart on a busy day in winter.,6,Image_5.png,effort,E6,11
20241122221158,Customers shop from a vendor at a dimly lit outdoor market,2,Image_6.png,effort,E9,11
20241126034153,"A man in a red jacket, white shorts, black shoes, and a hat sitting on a bench surrounded by lush greenery, preparing a meal outdoors",9,Image_7.png,effort,E13,11
20241122020058,A red off-road vehicle is perched on an uneven dirt path with a child wearing a green shirt and blue shorts in the back. There is a man in the front seato of the vehicle,11,Image_9.png,effort,E3,11
20241122210318,"A young individual stands in a grassy area, holding a rope attached to her horse, with a small fire in the foreground that they look onto as open land is in the background.",11,Image_1.png,effort,E6,12
20241121233403,People enjoy a leisurely walk on a paved pathway in a park with benches and lush grass on a cloudy day while a couple on a bench watch,1,Image_10.png,effort,E1,12
20241122214316,"A man with short hair in a black jacket, and a woman with long hair in a blue shirt sit on a bench overlooking a calm sea as the sun sets in the distance. A white fishing boat is crossing the water in front of them. In the distance, you can see a city skyline amidst the yellow, cloudy sunset.",10,Image_11.png,effort,E8,12
20241122221158,A boy is enjoying a sunny day outside on a scooter,6,Image_12.png,effort,E9,12
20241122020058,Two athletes in a competitive chase for the ball during a soccer match. One athlete is wearing a blue adidas uniform with the number 21 and the text sherwood. The other player is falling over and has a black and white uniform.,12,Image_13.png,effort,E3,12
20241122014416,"A traveler treks up a mountain in a quiet forest, taking in the serene winter landscape. ",10,Image_15.png,effort,E2,12
20241126034153,"A group of individuals made up of young and old men and women, standing and walking by an indoor water feature, engaging with the exhibit. There is orange fish in the water.",2,Image_2.png,effort,E13,12
20241122030706,"A lone man fishes beside a tranquil, foggy lake at dawn, under the shelter of a large tree with greenery and the sunset in the distance.",12,Image_3.png,effort,E5,12
20241122213136,City pedestrians walk by a street on a busy day. In the forefront is a man and a woman holding hands as they pass by a colorful bicycle cart. There is a mailbox on the right of the bicycle cart. Vehicles are stopped on the street as pedestrians are crossing. In the background are tall buildings.,5,Image_5.png,effort,E7,12
20241122221911,Customers bartering and purchasing from a vendor at a dimly lit outdoor market and busy street with a cab quickly passing in the background.,6,Image_6.png,effort,E10,12
2024,"A man in a red jacket sits on a bench surrounded by greenery, preparing a meal outdoors",1,Image_7.png,control,O,12
20241122020904,A red off-road vehicle is perched on an uneven dirt path in the middle of the desert with a child watching from above the vehicle in the distance. The vehicle looks to be uneven on the ground and stuck.,6,Image_9.png,effort,E4,12
20241122213136,"A young female stands in a grassy area, holding a rope attached to a horse. There is a small fire in the foreground and open land in the background where a man with a horse is standing.",10,Image_1.png,effort,E7,13
20241122014416,People enjoy a leisurely walk on a paved pathway in a park on a cloudy day with benches and luscious grass. ,11,Image_10.png,effort,E2,13
20241122221158,A couple sits on a bench overlooking a calm sea as the sun sets in the distance,10,Image_11.png,effort,E9,13
20241122221911,A young boy with a bright orange skate helmet is enjoying a sunny day outside on a scooter and jumping over a curb with his neighborhood in the background,12,Image_12.png,effort,E10,13
20241122020904,"Two female athletes in a competitive chase for the ball during a soccer match. The player in blue is shoving the player in white, who is yelling out as she descends towards the ground. The white player is mid-kick as she is being shoved.",5,Image_13.png,effort,E4,13
20241122020058,"A traveler treks along a steep snowy trail in a rocky, mountainous area. In front of him are two ski poles lodged into the snow. He has a backpack. On the left there is a bush with mossy rock behind it.",2,Image_15.png,effort,E3,13
2024,"A group of individuals stands by an indoor water feature, engaging with the exhibit",1,Image_2.png,control,O,13
20241122210318,"A lone figure stands fishing beside a tranquil lake at dawn, under the shelter of a large tree with fog forming above the water.",9,Image_3.png,effort,E6,13
20241122214316,"City pedestrians walk by a colorful puppet theater cart by a busy crosswalk. The puppet theater is attached to a tricycle, which is used to tow the theater around the city. In the background, you can see people crossing through the crosswalk, as two cop cars are stopped at the stoplight. In the very back, you can see tall white and tan buildings.",6,Image_5.png,effort,E8,13
20241126031716,A man and his daughter are purchasing food from a street vendor at a dimly lit outdoor market. The food cart is attended by a young woman and has a lot of food offerings. There are a few other people around and a taxi driving behind them.,9,Image_6.png,effort,E11,13
20241121233403,"A white male with a black hat,red jacket and white shorts with no socks siting on bench near shubbery cooking a meal in a portable cooker.",10,Image_7.png,effort,E1,13
20241122030706,"A red off-road Jeep with a suspension system is traversing an uneven rocky, dirt canyon with a small girl spectating in the distance.",8,Image_9.png,effort,E5,13
20241122214316,"A young girl in a black sweatshirt and pants stands in a grassy field. She is holding a rope connected to the halter of a light brown horse with a blonde mane. They both stand in front of a small fire in the foreground. In the background, you can see an older man in a blue collared shirt and blue jeans, next to a dark brown horse with a dark brown mane. In the very back, you can see a wooded area.",2,Image_1.png,effort,E8,14
20241122020058,People enjoy a leisurely walk on a paved pathway in a park with benches and lush grass on a cloudy day. There is a pavilion tent in the background. The closest bench features a man on a phone call and a large grey dog sitting on the bench.,5,Image_10.png,effort,E3,14
20241122221911,A couple sit cloesly on a bench overlooking a calm river and small boats as the sun sets behind the city skyline.,9,Image_11.png,effort,E10,14
20241126031716,"A young boy with a yellow shirt, gray shorts and orange helmet is outside using a scooter to jump on the pavement. It is a suburban environment with several white single family houses in the background. ",10,Image_12.png,effort,E11,14
20241122030706,Two female athletes wearing different colored jerseys in a competitive chase for posession of the ball during a soccer match in a green soccer field.,1,Image_13.png,effort,E5,14
20241122020904,A traveler climbs up a steep snowy cliff on a mountain. This traveler is focused on the task and is using ice picks to ascend the cliff.,8,Image_15.png,effort,E4,14
20241121233403,"A group of individuals stands by an indoor water feature, engaging with the exhibit that is a pool with fish and a plant",11,Image_2.png,effort,E1,14
20241122213136,A lone man wearing a cap stands beside a tranquil lake at dawn. He is fishing under the shelter of a large tree. The lake reflects the trees around it and the sky above.,3,Image_3.png,effort,E7,14
20241122221158,City pedestrians walk by a colorful street art vendor cart on a busy day,11,Image_5.png,effort,E9,14
20241126032439,Two customers interact with a vendor at a dimly lit outdoor market as a yellow taxi passes by. The vendor cart contains a lot of food and bright yellow corn. ,7,Image_6.png,effort,E12,14
20241122014416,"A man, in a red jacket, sits on a bench surrounded by greenery, preparing a meal outdoors.",1,Image_7.png,effort,E2,14
20241122210318,A red off-road vehicle is perched within an uneven desert gravel path with hard rock ridges with a spectator nearby.,1,Image_9.png,effort,E6,14
